{
  "$schema": "https://json-schema.org/draft/2020-12/schema",
  "$id": "https://ttrpg-sheet.local/schemas/content/pf1e/spells.schema.json",
  "title": "PF1e spell catalog",
  "type": "array",
  "items": {
    "type": "object",
    "additionalProperties": false,
    "required": ["id", "name", "spellLevel"],
    "properties": {
      "id": { "type": "string", "minLength": 1 },
      "name": { "type": "string", "minLength": 1 },
      "spellLevel": { "type": "integer", "minimum": 0, "maximum": 9 },
      "source": {
        "type": "object",
        "additionalProperties": false,
        "properties": {
          "book": { "type": "string" },
          "page": { "type": ["integer", "null"] },
          "rarity": { "enum": ["common", "uncommon", "rare", "unique"] }
        }
      }
    }
  }
}
